{
  "format": "ajfm-deck",
  "version": 1,
  "deck": {
    "name": "Лексика для пересказа",
    "folder": "Базовое",
    "language": "en-US",
    "scheduler": "fsrs6",
    "cardTypes": ["recognition", "recall", "listening", "pronunciation"],
    "source": "слова, без которых трудно рассказать, о чём была серия"
  },
  "notes": [
    {
      "term": "plot",
      "translation": "сюжет",
      "ipa": "/plɑːt/",
      "partOfSpeech": "noun",
      "example": "The plot of this episode is about a betrayal.",
      "exampleTranslation": "Сюжет этой серии — про предательство.",
      "cloze": "The ___ of this episode is about a betrayal.",
      "tags": ["пересказ"],
      "difficulty": "easy"
    },
    {
      "term": "to turn out",
      "translation": "оказаться",
      "ipa": "/tɜːrn aʊt/",
      "partOfSpeech": "phrasal verb",
      "example": "It turned out that he was lying the whole time.",
      "exampleTranslation": "Оказалось, что он всё это время врал.",
      "cloze": "It ___ ___ that he was lying the whole time.",
      "note": "Главный глагол пересказа: почти каждый поворот сюжета описывается через него.",
      "tags": ["пересказ", "phrasal"],
      "difficulty": "medium"
    },
    {
      "term": "to find out",
      "translation": "выяснить, узнать",
      "ipa": "/faɪnd aʊt/",
      "partOfSpeech": "phrasal verb",
      "example": "She finds out that her brother knew about it.",
      "exampleTranslation": "Она узнаёт, что её брат об этом знал.",
      "cloze": "She ___ ___ that her brother knew about it.",
      "tags": ["пересказ", "phrasal"],
      "difficulty": "easy"
    },
    {
      "term": "to reveal",
      "translation": "раскрыть, показать",
      "ipa": "/rɪˈviːl/",
      "partOfSpeech": "verb",
      "example": "The ending reveals who was behind it.",
      "exampleTranslation": "Концовка раскрывает, кто за этим стоял.",
      "cloze": "The ending ___ who was behind it.",
      "tags": ["пересказ"],
      "difficulty": "medium"
    },
    {
      "term": "to betray",
      "translation": "предать",
      "ipa": "/bɪˈtreɪ/",
      "partOfSpeech": "verb",
      "example": "He betrays his best friend to save himself.",
      "exampleTranslation": "Он предаёт лучшего друга, чтобы спастись.",
      "cloze": "He ___ his best friend to save himself.",
      "tags": ["пересказ"],
      "difficulty": "medium"
    },
    {
      "term": "to end up",
      "translation": "в итоге оказаться, закончить тем, что",
      "ipa": "/end ʌp/",
      "partOfSpeech": "phrasal verb",
      "example": "They end up working together.",
      "exampleTranslation": "В итоге они начинают работать вместе.",
      "cloze": "They ___ ___ working together.",
      "note": "После «end up» глагол идёт с -ing: end up working, а не end up to work.",
      "tags": ["пересказ", "phrasal"],
      "difficulty": "medium"
    },
    {
      "term": "meanwhile",
      "translation": "тем временем",
      "ipa": "/ˈmiːnwaɪl/",
      "partOfSpeech": "adverb",
      "example": "Meanwhile, the police are getting closer.",
      "exampleTranslation": "Тем временем полиция подбирается всё ближе.",
      "cloze": "___, the police are getting closer.",
      "note": "Связка для параллельных линий — без неё пересказ разваливается на список.",
      "tags": ["пересказ", "связки"],
      "difficulty": "easy"
    },
    {
      "term": "eventually",
      "translation": "в конце концов",
      "ipa": "/ɪˈventʃuəli/",
      "partOfSpeech": "adverb",
      "example": "Eventually he agrees to help.",
      "exampleTranslation": "В конце концов он соглашается помочь.",
      "cloze": "___ he agrees to help.",
      "note": "Ложный друг: это не «эвентуально» и не «возможно», а «в итоге».",
      "tags": ["пересказ", "связки"],
      "difficulty": "hard"
    },
    {
      "term": "to get away with",
      "translation": "выйти сухим из воды",
      "ipa": "/ɡet əˈweɪ wɪð/",
      "partOfSpeech": "idiom",
      "example": "He almost gets away with it.",
      "exampleTranslation": "Он почти выходит сухим из воды.",
      "cloze": "He almost ___ ___ ___ it.",
      "tags": ["пересказ", "idiom"],
      "difficulty": "hard"
    },
    {
      "term": "flashback",
      "translation": "сцена из прошлого",
      "ipa": "/ˈflæʃbæk/",
      "partOfSpeech": "noun",
      "example": "A flashback shows what happened ten years ago.",
      "exampleTranslation": "Сцена из прошлого показывает, что случилось десять лет назад.",
      "cloze": "A ___ shows what happened ten years ago.",
      "tags": ["пересказ", "кино"],
      "difficulty": "easy"
    },
    {
      "term": "cliffhanger",
      "translation": "обрыв на самом интересном",
      "ipa": "/ˈklɪfhæŋər/",
      "partOfSpeech": "noun",
      "example": "The episode ends on a cliffhanger.",
      "exampleTranslation": "Серия обрывается на самом интересном месте.",
      "cloze": "The episode ends on a ___.",
      "tags": ["пересказ", "кино"],
      "difficulty": "medium"
    },
    {
      "term": "to make up one's mind",
      "translation": "решиться, определиться",
      "ipa": "/meɪk ʌp wʌnz maɪnd/",
      "partOfSpeech": "idiom",
      "example": "She finally makes up her mind to leave.",
      "exampleTranslation": "Она наконец решается уйти.",
      "cloze": "She finally ___ ___ her ___ to leave.",
      "tags": ["пересказ", "idiom"],
      "difficulty": "hard"
    },
    {
      "term": "on purpose",
      "translation": "намеренно",
      "ipa": "/ɑːn ˈpɜːrpəs/",
      "partOfSpeech": "phrase",
      "example": "He did it on purpose, not by accident.",
      "exampleTranslation": "Он сделал это намеренно, а не случайно.",
      "cloze": "He did it ___ ___, not by accident.",
      "tags": ["пересказ"],
      "difficulty": "easy"
    },
    {
      "term": "to stand up to",
      "translation": "дать отпор",
      "ipa": "/stænd ʌp tuː/",
      "partOfSpeech": "phrasal verb",
      "example": "She finally stands up to her boss.",
      "exampleTranslation": "Она наконец даёт отпор начальнику.",
      "cloze": "She finally ___ ___ ___ her boss.",
      "tags": ["пересказ", "phrasal"],
      "difficulty": "medium"
    },
    {
      "term": "twist",
      "translation": "неожиданный поворот",
      "ipa": "/twɪst/",
      "partOfSpeech": "noun",
      "example": "There is a twist at the end.",
      "exampleTranslation": "В конце есть неожиданный поворот.",
      "cloze": "There is a ___ at the end.",
      "tags": ["пересказ", "кино"],
      "difficulty": "easy"
    },
    {
      "term": "to cover up",
      "translation": "скрыть, замять",
      "ipa": "/ˈkʌvər ʌp/",
      "partOfSpeech": "phrasal verb",
      "example": "They try to cover up the whole thing.",
      "exampleTranslation": "Они пытаются замять всё это дело.",
      "cloze": "They try to ___ ___ the whole thing.",
      "tags": ["пересказ", "phrasal"],
      "difficulty": "medium"
    },
    {
      "term": "to blame someone for",
      "translation": "винить кого-то за",
      "ipa": "/bleɪm ˈsʌmwʌn fɔːr/",
      "partOfSpeech": "phrase",
      "example": "He blames his partner for the failure.",
      "exampleTranslation": "Он винит напарника за провал.",
      "cloze": "He ___ his partner ___ the failure.",
      "note": "Предлог именно «for»: blame him for it, не blame him in it.",
      "tags": ["пересказ"],
      "difficulty": "medium"
    },
    {
      "term": "reluctantly",
      "translation": "неохотно",
      "ipa": "/rɪˈlʌktəntli/",
      "partOfSpeech": "adverb",
      "example": "He reluctantly agrees to the plan.",
      "exampleTranslation": "Он неохотно соглашается на план.",
      "cloze": "He ___ agrees to the plan.",
      "tags": ["пересказ"],
      "difficulty": "hard"
    },
    {
      "term": "to look forward to",
      "translation": "ждать с нетерпением",
      "ipa": "/lʊk ˈfɔːrwərd tuː/",
      "partOfSpeech": "phrasal verb",
      "example": "I'm looking forward to the next episode.",
      "exampleTranslation": "Жду не дождусь следующей серии.",
      "cloze": "I'm ___ ___ ___ the next episode.",
      "note": "Здесь «to» — предлог, поэтому дальше идёт -ing: looking forward to seeing.",
      "tags": ["пересказ", "phrasal"],
      "difficulty": "hard"
    },
    {
      "term": "subplot",
      "translation": "побочная линия",
      "ipa": "/ˈsʌbplɑːt/",
      "partOfSpeech": "noun",
      "example": "There is a subplot about his brother.",
      "exampleTranslation": "Есть побочная линия про его брата.",
      "cloze": "There is a ___ about his brother.",
      "tags": ["пересказ", "кино"],
      "difficulty": "medium"
    }
  ]
}
