{
  "format": "ajfm-deck",
  "version": 1,
  "deck": {
    "name": "Retelling vocabulary",
    "folder": "Basics",
    "language": "en-US",
    "scheduler": "fsrs6",
    "cardTypes": [
      "recognition",
      "recall",
      "listening",
      "pronunciation"
    ],
    "source": "words it's hard to retell an episode without"
  },
  "notes": [
    {
      "term": "plot",
      "translation": "the main story of a film or episode",
      "ipa": "/plɑːt/",
      "partOfSpeech": "noun",
      "example": "The plot of this episode is about a betrayal.",
      "cloze": "The ___ of this episode is about a betrayal.",
      "tags": [
        "retelling"
      ],
      "difficulty": "easy"
    },
    {
      "term": "to turn out",
      "translation": "to be discovered to be true in the end",
      "ipa": "/tɜːrn aʊt/",
      "partOfSpeech": "phrasal verb",
      "example": "It turned out that he was lying the whole time.",
      "cloze": "It ___ ___ that he was lying the whole time.",
      "note": "The main verb of any retelling: almost every plot twist is told with it.",
      "tags": [
        "retelling",
        "phrasal"
      ],
      "difficulty": "medium"
    },
    {
      "term": "to find out",
      "translation": "to discover a fact or learn something",
      "ipa": "/faɪnd aʊt/",
      "partOfSpeech": "phrasal verb",
      "example": "She finds out that her brother knew about it.",
      "cloze": "She ___ ___ that her brother knew about it.",
      "tags": [
        "retelling",
        "phrasal"
      ],
      "difficulty": "easy"
    },
    {
      "term": "to reveal",
      "translation": "to show something that was hidden",
      "ipa": "/rɪˈviːl/",
      "partOfSpeech": "verb",
      "example": "The ending reveals who was behind it.",
      "cloze": "The ending ___ who was behind it.",
      "tags": [
        "retelling"
      ],
      "difficulty": "medium"
    },
    {
      "term": "to betray",
      "translation": "to be disloyal to someone who trusts you",
      "ipa": "/bɪˈtreɪ/",
      "partOfSpeech": "verb",
      "example": "He betrays his best friend to save himself.",
      "cloze": "He ___ his best friend to save himself.",
      "tags": [
        "retelling"
      ],
      "difficulty": "medium"
    },
    {
      "term": "to end up",
      "translation": "to finally be in a situation, often without planning it",
      "ipa": "/end ʌp/",
      "partOfSpeech": "phrasal verb",
      "example": "They end up working together.",
      "cloze": "They ___ ___ working together.",
      "note": "After “end up” the verb takes -ing: end up working, not end up to work.",
      "tags": [
        "retelling",
        "phrasal"
      ],
      "difficulty": "medium"
    },
    {
      "term": "meanwhile",
      "translation": "at the same time, in another place",
      "ipa": "/ˈmiːnwaɪl/",
      "partOfSpeech": "adverb",
      "example": "Meanwhile, the police are getting closer.",
      "cloze": "___, the police are getting closer.",
      "note": "The linker for parallel storylines — without it a retelling becomes a list.",
      "tags": [
        "retelling",
        "linkers"
      ],
      "difficulty": "easy"
    },
    {
      "term": "eventually",
      "translation": "in the end, after a long time",
      "ipa": "/ɪˈventʃuəli/",
      "partOfSpeech": "adverb",
      "example": "Eventually he agrees to help.",
      "cloze": "___ he agrees to help.",
      "note": "In many languages a similar word means “possibly” — here it means “in the end”.",
      "tags": [
        "retelling",
        "linkers"
      ],
      "difficulty": "hard"
    },
    {
      "term": "to get away with",
      "translation": "to do something wrong and not be punished",
      "ipa": "/ɡet əˈweɪ wɪð/",
      "partOfSpeech": "idiom",
      "example": "He almost gets away with it.",
      "cloze": "He almost ___ ___ ___ it.",
      "tags": [
        "retelling",
        "idiom"
      ],
      "difficulty": "hard"
    },
    {
      "term": "flashback",
      "translation": "a scene that shows events from the past",
      "ipa": "/ˈflæʃbæk/",
      "partOfSpeech": "noun",
      "example": "A flashback shows what happened ten years ago.",
      "cloze": "A ___ shows what happened ten years ago.",
      "tags": [
        "retelling",
        "film"
      ],
      "difficulty": "easy"
    },
    {
      "term": "cliffhanger",
      "translation": "an ending that leaves you in suspense",
      "ipa": "/ˈklɪfhæŋər/",
      "partOfSpeech": "noun",
      "example": "The episode ends on a cliffhanger.",
      "cloze": "The episode ends on a ___.",
      "tags": [
        "retelling",
        "film"
      ],
      "difficulty": "medium"
    },
    {
      "term": "to make up one's mind",
      "translation": "to decide",
      "ipa": "/meɪk ʌp wʌnz maɪnd/",
      "partOfSpeech": "idiom",
      "example": "She finally makes up her mind to leave.",
      "cloze": "She finally ___ ___ her ___ to leave.",
      "tags": [
        "retelling",
        "idiom"
      ],
      "difficulty": "hard"
    },
    {
      "term": "on purpose",
      "translation": "intentionally, not by accident",
      "ipa": "/ɑːn ˈpɜːrpəs/",
      "partOfSpeech": "phrase",
      "example": "He did it on purpose, not by accident.",
      "cloze": "He did it ___ ___, not by accident.",
      "tags": [
        "retelling"
      ],
      "difficulty": "easy"
    },
    {
      "term": "to stand up to",
      "translation": "to refuse to accept bad treatment from someone",
      "ipa": "/stænd ʌp tuː/",
      "partOfSpeech": "phrasal verb",
      "example": "She finally stands up to her boss.",
      "cloze": "She finally ___ ___ ___ her boss.",
      "tags": [
        "retelling",
        "phrasal"
      ],
      "difficulty": "medium"
    },
    {
      "term": "twist",
      "translation": "an unexpected change in the story",
      "ipa": "/twɪst/",
      "partOfSpeech": "noun",
      "example": "There is a twist at the end.",
      "cloze": "There is a ___ at the end.",
      "tags": [
        "retelling",
        "film"
      ],
      "difficulty": "easy"
    },
    {
      "term": "to cover up",
      "translation": "to hide the truth about something bad",
      "ipa": "/ˈkʌvər ʌp/",
      "partOfSpeech": "phrasal verb",
      "example": "They try to cover up the whole thing.",
      "cloze": "They try to ___ ___ the whole thing.",
      "tags": [
        "retelling",
        "phrasal"
      ],
      "difficulty": "medium"
    },
    {
      "term": "to blame someone for",
      "translation": "to say someone is responsible for something bad",
      "ipa": "/bleɪm ˈsʌmwʌn fɔːr/",
      "partOfSpeech": "phrase",
      "example": "He blames his partner for the failure.",
      "cloze": "He ___ his partner ___ the failure.",
      "note": "The preposition is “for”: blame him for it.",
      "tags": [
        "retelling"
      ],
      "difficulty": "medium"
    },
    {
      "term": "reluctantly",
      "translation": "without wanting to",
      "ipa": "/rɪˈlʌktəntli/",
      "partOfSpeech": "adverb",
      "example": "He reluctantly agrees to the plan.",
      "cloze": "He ___ agrees to the plan.",
      "tags": [
        "retelling"
      ],
      "difficulty": "hard"
    },
    {
      "term": "to look forward to",
      "translation": "to be excited about something that will happen",
      "ipa": "/lʊk ˈfɔːrwərd tuː/",
      "partOfSpeech": "phrasal verb",
      "example": "I'm looking forward to the next episode.",
      "cloze": "I'm ___ ___ ___ the next episode.",
      "note": "Here “to” is a preposition, so -ing follows: looking forward to seeing.",
      "tags": [
        "retelling",
        "phrasal"
      ],
      "difficulty": "hard"
    },
    {
      "term": "subplot",
      "translation": "a secondary storyline",
      "ipa": "/ˈsʌbplɑːt/",
      "partOfSpeech": "noun",
      "example": "There is a subplot about his brother.",
      "cloze": "There is a ___ about his brother.",
      "tags": [
        "retelling",
        "film"
      ],
      "difficulty": "medium"
    }
  ]
}
